,full_text
192,sekarang orang senang bitcoin ke usd mungkin bisa lihat usd nanti semua institusi cukong main besar lain pada take profit iya masa beli doang jual akan lihat the real bloodbath
193,bilang elon pompom doge harga jadi naik bilang elon mau adopsi crypto harga jadi naik lalu elon bilang tesla tangguh bayar bitcoin harg jadi turun you guys believe this shyte if yes you guys are ngmi
194,dulu jaman turun crypto udah kayak sarap bayangin bitcoin kemarin turun crypto lain turun yang lebih gimana kalo turun woi altcoin bakal berak darah shitcoin udah berak jadi darah darah berak darah
195,percaya wargenet twitter cuma punya usd bitcoin duit dapet minjem temen kuliah akan ngaruh apaapa bijak tesla
196,akhir bitcoin btc breakout sinyal ikut prediksi analisis teknikal btc
197,bitcoin ethereum lain lah dikitdikit kayak bnb kcs ftt jangan lupa ajar sisi teknikalnya dlu
198,join lah sini buat ajar trading biar pas bitcoin crash ludes semua uang kontak telegram only mkbijaksana nonacrypto
199,saham bris kata lebih besar bitcoin gainsnya mana kemarin account pompom bilang gitu sini dong ken aku ketawain kata fundmntalny gu noh
200,bestnya siapa pandai main bitcoin semua tu
201,aing nunggu bitcoin balik bawah banyak kisah hilang uang habis modal siapin popcorn
202,kini harga lepas harga kg emas
203,yen rekor
204,kan bitcoin ke k bang ke juta usd bang kamu tinggal kamu bitcn bs k jut usd bodo saya gaakan beli kalau ada setup harga bagus nunggu koreksi nanti kamu tinggal kereta dong gapapa arti rejeki
205,beliin bitcoin semua bisa beli rumah cash duit ludes there is no inbetween
206,minggu akhir at least sodara nanya gimana cara main bitcoin at least temen lama ilang tau datang minta advice masuk crypto gimana i dont know somehow aku mau ngeladenin either ignore jawab perlu soal biar rugi
207,so in case of bitcoin crypto lain lebih naik ini kalau udah naik gin emang bagus buat masuk tidak lah tunggu koreksi dlu
208,beli bitcoin sekarang masuk juta pake tabung buat sekolah a bisa jadi juta kejap bro siapsiap rugi besar aku bilang gitu
209,kan bang taun beda bitcoin naik terus bullish banget bang
210,kalau yang nanya bitcoin legalharam se nya kasih semua trader indonesia mungkin tuju hal
211,tentu model pikir orang menggu an bitcoincryptocurrency tanya gimana dapat lo bitcoin
212,bitcoin k usd sampe juta tuh inti jangan lupa
213,bilang investasi bitcoin aja yang bilang crypto underlyingnya yang bilang technical analysis bullshit lalu ada aku yang cuan terus tinggal berak
214,gue yakin paling bawah udah paling ganas simpan makhluk aneh sana penjara makhluk scp portal area maklhuk purba sana buat se zoo ruang penyiksaanpenculikanpembunuhan sana dokumen rahasia negara bitcoin ruang psychopath
215,tiba saat orang tanya agama apa jawab bitcoin
216,sekarang harga k kalau ikut prediction puak analisis onchain data and so on pi k either eoy awal next year think about it x on your investment for less than months hati mau kental bila price correction keep hodl
217,hantar malaysia el salvador menggu an lightning network
218,dimarahin sama moonbois para ingpluencer nih btc
219,dulu jaman bitcoin rebu usd bilang mau coba short deket rebu nah sekarang kok deket rebu malah pada jadi moonbois manusia memang unik
220,bitcoin desentralisasi suplai batas lawan bank sentral blablabla what if bank sentral laku money printer go brrrr alias cetak uang sebanyakbanyaknya lalu buat beli bitcoin hayoloh mau pihak tradfi laser eyes
221,cari crypto sudah dekat sama ath all time high harga tinggi pantau mau langsung beli bebas ath jebol borong diemin biarin naik terus bitcoin tandatanda crash tunggu upeti tanda terima kasih not financial advice
222,hasil analisa yang kalau cocok sini debat ngopi bahas civilized bitcoin bonus mungkin ethereum mungkin wick al an xrp bawah mungkin
223,kalau cuan aku jenius crypto masa depan desentralisasi wooo legit maslahat umat kalau rugi bitcoin scam eth ponzi crypto haram judi monkey business ada underlying valuenya
224,kenal agama baru bitcoin
225,dia tipsnya baik jangan beli sekarangsekarang sabar aja beberapa minggu bulan saat koreksi dalem situ bisa beli aset crypto harga relatif murah mau beli ayam pasar aja nawar masa beli bitcoin kagak nawar
226,no shitcoin mungkin iya bitcoin eth kawan not at all
227,semua sadar waktu
228,burrrratttttt
229,gap atas kecil isi nah pilih akan lanjut atas tutup gap atas lama blm isi pas jatuh k lanjut turun dulu nutup gap bawah di kk
230,bayar janji updatesgt video analisa baru whales bukti gerak btc tsla mmm tonton langsung
231,tunggu yaajika proyek defi stablecoin gugat oleh arti koreksi
232,hash rate bitcoin hash rate rupa indikator sehat jaring blockchain makin tinggi hash rate makin banyak miners partisipasi makin tinggi aman jaring naik hash rate bitcoin cermin percaya makin tingkat
233,mumpung turun harga coba nabung nyicil dapat minimal bitcoin beberapa ethereum paham cara ajar jangan terburuburu coba arah tidak jual jual sedikit di masa depan
234,bitcoin usia tahun januari satoshi amoto hasil goblok pertama
235,news selisih pertama crypto regulator bahama amp manajemen baru ftx gemini genesis amp dcg news gemini regulator bahama amp ftx genesis dcg watch
236,tahun lalu januari genesis block bitcoin goblok pertama hasil satoshi amoto serta tulis chancellor on brink of second bailout for banks ingat apa bitcoin cipta
237,tahun lalu hari aset digital ubah dunia lama lahir selamat ulang tahun
238,hbd bitcoin
239,agak veteran dunia crypto mungkin saran paling harga buat baru masuk stick to bitcoin mungkin sedikit ethereum everything else is kalau cukup kuat fundamental tiputipu
240,ceritain gimana kalian pertama kali kenal dong
241,crypto bros minggu lalu salah satu petinggi bank sentral eropa bilang bitcoin sedang tuju ketidakrelevanan bilang promosi bitcoin milik resiko reputasional kalian gimana
242,hari tahun lalu goblok nol genesis goblok bitcoin mining semangat muncul bitcoin adalah sistem uang sekarang bobrok
243,misal harga crypto anggap aja bitcoin k usd lalu mau beli hasil analisa lihat mungkin turun k usd kita beli sekarang nunggu di k catat jadi k dulu langsung terbang ke k tarik nih bahas
244,weekly updates buat bitcoin pasar crypto lain hasil riset crypto beberapa tahu jadi investor trader siapa mau
245,lalu public nah sini masyarakat umum masuk lihat aja pas bitcoin usd semua orang ngomongin crypto tukang bakso depan rumah investasi bitcoin akun instagram ubah jadi edukasi crypto mulai semua bahas crypto crypto crypto masih sampe sekarang
246,silah lihat hargaharganya mungkin bedabeda tipis lah exact number jadi bitcoin akan bullish lanjut naik sudah kondisi ya
247,btc bitcoin turun hampir sejak akhir vs kembang web dunia kamu anti crypto moda investasi kamu bisa abai maju web saja
248,contoh predictive bitcoin naik zona fibonacci turun k
249,wajar cbdc
250,bandingin dulu sama bitcoin
251,jangan lupa orang teriakteriak bullish k soon orang sama nyuruh kalian beli pas ath lalu bilang harga bitcoin ke k
252,bitcoin closing doji tanda sideways area saya mention kemarinkemarin ema golden cross nih btw
253,bangun tidur bitcoin ngepump
254,sangka harga naik news update crypto bubbles teknikal bitcoin wisdomtree aju etf bitcoin spot deutsche bank laku lisensi crypto custody big update polygon labs klik sini
255,beberapa jam akhir sideway kuat dorong atas k ekspektasi apakah naik di k hari
256,kadangkadang rezeki datang bentuk free homemade french fries cawan air limau kasturi sejuk pandang alam meng harga naik udara segar tiada cahaya palsu tiada npc around selfcustodial bitcoin wallet amp baca tulis quite few in the dms tanya mana
258,dah beli bitcoin bagus sekarang keluar btc tu exchanger masuk cold wallet simpan btc exchanger ibarat simpan emas bank bukan milik benar bajar jadi ftx shut down simpan semua hilang btc masing
259,belum bahas kena lefttranslated cycle supercycle bob ingat kalau cycle kali nampak terlalu mudah para bitcoin holder dalam tahun kemarin jadi koreksi average sekitar per koreksi ratarata
260,bikin tidur nih bitcoin
261,looks familiar guys chainlink rupa coin movementnya konsolidasi sejak mei pernah lebih tinggi tidak pernah lebih rendah based on theory konsolidasi akumulasi will it be like bitcoin cash
262,orang kapasitas intelektual tentu beneran ngerti apa bitcoin akan beli
263,quick update silah nikmat analisanya let me know what you think
264,news lansir dri grup besar bitcoin tl cryptoquant yakin tuju sec spot bitcoin etf picu sellthenews event dapat turun harga hingga k
265,crypto penuh lika liku gimana kirakira crypto nih kriptosias
266,si coin crypto paling plagiat coin apa kirakira coba tebak mustahil ada tau doge milik tekhnologi sama bitcoin cipta sindir tekhnologi bitcoin siapa sangka coinya malah jadi kenal bitcoin
267,bitcoin ethereum xrp bnb semua close candle timeframe h nya kayak gin jelek ya most likely cryptocrypto lain bgtu
268,baru sutradara keren bikin karya seni lihat tuh bitcoin poster
270,konteks pernah backtest cara beli bitcoin ampuh banget lihat sini video
271,filem vigilante ubah sistem ni banyak dah rasa semua tak jaya buat satu filem jaya plak tengok dunia ni jadi apa kalau sistem ni dah takda orang dah tak fiat beli latte emas bitcoin
272,bouncebit bb binance research bayang bitcoin uang digital simpan gitu doang nah bouncebit hadir konsep restaking btc buat bitcoin hasil cuan bouncebit punya kerangka kerja inovatif gabung cefi centralized
273,bitcoin juga tarik iotex
274,sejarah baru bitcoin per tanggal mei akhir inflow gbtc grayscale source farside investors
275,analisa bitcoin closing candle april merah di sini
276,breaking jaring lampau miliar transaksi proses
277,bitcoin udah naik per maret saat beli lebih baik cari tau dulu apa bitcoin bitcoin kumpul buku layak to read about a thread
278,lfg sofar price action movement maintance bullish momentum amp baru keluar akumulasi zone cat tarik karna salah satu platform gamefi ada ekosistem bitcoin itu tokennya digu an ikut launchpad bakeryswap
279,minggu saya good momentum trade bitcoin lihat weekly close lets breakdown the setup
280,cryptocurrency pertama bukan konsep cryptocurrency hadir tahun satoshi amoto rilis whitepaper bitcoin konsep cryptocurrency pertama kali cipta orang cryptographer nama david chaum juga cipta
281,mas kalau bitcoin milyar entar mau ngapain mas jadi tukang gambar anime aja mas masa depan sugoi sekali
282,bitcoin roket terbang ini altcoins tekan btcd nyala
283,baru untuk maret putus blackrock tunda capai ath mata uang utama alami tumbuh kuat shib bonk pepe doge pimpin reli periksa gambar
284,bitcoin outlook btc screenshot simpan dulu aja kembali beberapa minggubulan kalau salah udah nama analisa hapus kayak yang ngaku jago pas salah hapus akan saya analisa salah nah sekarang analisa
285,investasi apa ciamik aman obligasi swasta fr ori middle pp reksadana pt high risk blue chip bitcoin btcbig cap hrr bitcoin altssmallmedium cap perp contract smallmedium cap forexgold trading deposito tanah emas skip rugi brok
286,monthly close bitcoin bitcoin monthly close candle jadi hari saat bedasarkan price action cukup khawatir potensi chart pattern tweezer top bitcoin tahan harga maintance bullish
287,bitcoin jalan tol apa jaring layer bitcoin bayang bitcoin jalan raya makin banyak orang menggu annya makin macet jadi jaring layer bitcoin jalan tol baru bangun atas jalan raya bitcoin jalan tol mungkin lebih
288,quiz tebak harga bitcoin weekly close besok angka benar atau dekat menang reward gopay k
289,kapan alt season benar indikator altseason saya gu an cukup simpel btc reach new peak altseason bawah adalah comparison chart garis putih mc bitcoin garis ungu mc all crypto exclude top sini simpul altseason
290,bayang ke orang pro bitcoin kira kira berapa harga bitcoin saat
291,breaking atas
292,breaking calon presiden donald trump kata tidak biar negara ambil alih dominasi amp
293,breaking sentuh harga
294,bitcoin monthly chaupdate mei edition welcome mei bulan april gadanggadang bulan bullish high probability chance harga naik nyata banding balik kita lihat monthly close hari bitcoin monthly return bulan april di tutup minus
295,tahun cipta bitcoin capai miliar transaksi
296,mantan ceo twitter jack dorsey kucur usd juta opensats kembang bitcoin
297,game plan bitcoin market cryptocurrency hari belakang udah mulai start recovery ini jadi karna beberapa seperti sentimen dovish fed fomc sudah sentuh major support level ini bitcoin naik dari current bottom price
298,nah nyuruh media beri berita cihuy harga makin naik orang makin giur orang awam ken dong denger headline investasi cryptocurrency untung x lipat orang sama kayak pak jon di cerita lgsg beli pikir panjang
299,nah lanjut habis sahur kalau waktu besok kerja sih heheh saya bahas sedikit bagaimana cara reaksi buah berita ttg cryptocurrency stay tuned
300,nah situ simpul ripple coin cryptocurrency bagus investasi jangka panjang mungkin taun atau taun saat banyak crypto abal musnah ripple jadi salah satu tahan
301,nah main cryptocurrency handal halah padahal sering rugi saya coba cari orang sepassion mulai cari hubung cryptocurrency
302,nah pribadi mau nyoba sharing technical analysis cryptocurrency minggu sekali kalo capek lol buat tambah online presence sukur kasi sertifikasi gratis jadi financial advisorextra gaji besar banget loh hahaha add linkedin kalau mau lihat hehe
303,oya fundamental ini berita untung elektabilitas trump akan ikut dgn naik harga bitcoin crypto
304,bitcoin ramal penuh sendiri
305,mulai masuk perlahan bitcoin moga rugi bang
306,jadi miner kena jadi holder mine amp simpan tak mine amp jual terus so kena backup income mining bitcoin ni kena mindset bitcoin dapat tu retirement plan bukan instant gratification
307,luang minit ajar asas bitcoin
308,gimana sikap tepat lihat berita cryptocurrency nih kasih contoh dulu
309,pasu tu apa aja gaji bisnis main cryptocurrency punya rumah tu kayak gimana yang milyar minimal jauh dari kota banyak hewan piara tahun capai gimana cara arti punya uang milyar roughly
311,lihat berita ya korea kata mau ngeban cryptocurrency perhati tanggal tengahakhir januari
312,ada tips kalau putus main cryptocurrency lihat grafik ya baca baik udah pernah dipost sih tetep baca aja perhati tiap detail fase
313,search kena blockchain cryptocurrency ketemu sama orang agak pengaruh blockchain indonesia langsung add message kebut gasss biasa kasi tau dapet info dari mana kasi sedikit latar belakang gimana
314,backgroundcover photo kasih mudah aja kayak tuh biru motif putih dikit mau ganti sama bau cryptocurrency ahahaha contoh bagus lain gambar gedung langit yang bau bisnisprofesionalism utk engineer mgkn gbr site konstruksi
315,kerja bisnis iniitu organisasi main cryptocurrency temen keluarga pacar fitness lainujungnya cuma saya capek yang kerja kehandle
316,ayo bandung rapat tanggal juli jam jam kupas tuntas kena cryptocurrency moda investasi
317,siapa ngadain salah satu cryptocurrency international ada besar coin market cap bisa jadi sempat emas boost your career cv ada tapi
318,saangat basic jadi gausah malu ayoo datang bocor acara sesi kenal blockchain cryptocurrency sesi mindset dasar main cryptocurrency sesi networking event alias tanya till drop
319,apakah gerangan rencana bulan agustus september ada workshop hubung blockchain danatau cryptocurrencytapi segi pemrogramanteknologi nya bukan ahli lol sekarang sedang cari audience interested
320,alternatif steemit blogging bayar pakai cryptocurrency minat japri ajarin mungkin waktu bahas kalo udah sukses
321,thanks a lot datang event hari neng banget lihat antusiasme coming soon event buat developer a it programmer se nya sponsor sama salah satu cryptocurrency besar tentatif tahap nego kalo mau tag dulu aja teman yang a it
322,tau cyronium cryptocurrency yang kata buat a bangsa minta opini ttg atau apa impresi temen ttg cyronium mau bikin artikel thanks
323,baca dulu kalo mau main bitcoin gt cryptocurrency part
324,cari bikin film minat ikut lomba saya bisa sedia tahu kena blockchain cryptocurrency shall we make a team
326,menggu an blockchain cryptocurrency hanya tip of the iceberg aplikasi blockchain banyak banget karena adalah buah teknologi menggu an komputer butuh banyak nama talent bisa programmingcoding paling ngerti dunia it
327,nah beda cryptocurrency satu bukan rupiah dolar tapi nama cryptocurrency nya misal bitcoin ethereum ripple litecoin nah ini jadi media investasi
328,paling kenal cryptocurrency gampang cryptocurrency tu se punya jatah dalam blockchain sebut mudah kayak uang elektronik akun catat punya uang rb misal
329,mirip sama harga tanah fluktuatif harga jatah di blockchain ubah kalau tanah faktor area kondisi kalau cryptocurrency faktor banyak mungkin jadi thread sendiri jelas
330,ajar ini pasar paling volatile paling manipulatif dunia cryptocurrency goreng jadi kalo mau analogi pak jokowi mau milih cawapres a semua technical analysis harap orang udah investasi harap harga naik
331,wah panjang banget kayak kalo materi betul perangkat komputer sedang pakai support utk software berat sprti doa investasi di cryptocurrency hasil saya beli laptop baru coba ngetwit ttg
332,salah satu sakit generasi milenial sih instant gratification mau segala cepet ada orang estimasi kalo main cryptocurrency untung langsung semua tabung buat main crypto tidak denger resiko loss ada
333,fullkan investasi cryptocurrency juta per bulan cryptocurrency sangat volatile agak susah nentuin roi nya anggap aja tumbuh per bulan note kalau mau investasi cryptocurrency ajar dulu jangan investasi hal kamu paham
334,federal election commission gives green light for political mining pool donations
335,apa aja sih aplikasi blockchain cryptocurrency security healthcare financial service manufacture government charity real estate tourism transport media lain cntoh lain
336,baca nah baca yang abu mulai baca manga baca grafik harga cryptocurrency baca buku sisa main game
337,pribadi di cryptocurrency kalau mau ngikut kurang saran sihhigh risk volatile banget mungkin kalau mau aja silahkanterakhir lihat berita pasar turun banget banget nih
338,kalau investasi cryptocurrency benar gain nya cuma per bulan bahkan naik x lipat mohon sangat catat kalau paham ttg investasi cryptocurrency jangan dulu tidak saran ngasih gambar saya laku biasa gmana
339,tahun memang pasar cryptocurrency sedang bull market banyak orang mau cari uang mudah dong banyaaak banget orang bikin cryptocurrencynya sendiri lalu bikin biar investor mau investasi crypto buat ini istilah ico initial coin offering
340,sekarang bitcoin istilah banyak org salah kaprah cryptocurrency bitcoin salah bitcoin cryptocurrency market cap besar yang pertama kalo salah cryptocurrency bukan bitcoin banyak orang indonesia salah hal ini
341,sama kayak nyebut semua mie instan indomie wajar technically salah kalau dunia cryptocurrency salah crypto dan lain beda jauh banget
342,lagi kata di awal bitcoin sama dgn cryptocurrency sama nya indomie tdk sama dgn mie instan saat banyak orang bilang mie instan indomie sama banyak orang bilang cryptocurrency bitcoin benar cara teknis tidak tepat
343,benar saya burst bubble nya cryptocurrency lain lebih kurang cryptocurrency mudah bikin bisa bikin cryptocurrency sendiri pakai platform ethereum misal dash nxt bagai
344,awal surga ico pokok semua orang bikin coinnya sendiri fundraising asal kata blockchain coin cryptocurrency disruption segala nya ada kata the next bitcoin
345,disclaimer background amp tahu kena cryptocurrency batas di bidang ekonomi finansial sampai dapat yang tau take it with a grain of salt kalau tuju alangkah baik kasih data argumen
346,nah ibaratny bikin cryptocurrency buat ekosistem aplikasi dunia nyata mudah analogi sama mie nih semua bisa bikin mie instan bikin merk mie instan lolos bpom mui rasany trjaga perusahaanny bsa sustain mudah
347,lanjut somengenai ico bitcoin cryptocurrency
348,bos department belah minta diajarin main cryptocurrency saat kolega minta kasi tau cara buka rekening sahamemang aku jago investasi mana dari dulu paling baru bep at best
349,central bank digital currencies are a trojan horse for bitcoin
350,hubung sama bitcoin cryptocurrency apa pertama banyak masih salah aprah bitcoin sama persis cryptocurrency analogi mie instan tadi dua banyak cryptocurrency tuh dipairin sama bitcoin
351,argumen bitcoin cryptocurrency mati silah cari dalam lama adoption development implementation jauuuuuuuhhh lebih banyak tahun
352,sebab massive massive massive spike harga cryptocurrency bitcoin usd coba ethereum juta rupiah sangat massive nah lalu waktu ke realita beberapa faktor yang bkin harga turun jauuuhhh sampe orang bilang bubble
353,bitcoin mati bitcoin bubble ledak main cryptocurrency udah biasa denger ini data
354,lalu dapat kenapa tahun pasar cryptocurrency darah bukan bitcoin bubblenya pecah dunia ico bodong
355,akhir desember awal januari bikin thread blogpost jalan tahun jadi investortrader cryptocurrency regardless hasil untung apa rugi
356,jadi cryptocurrency mati mungkin anggap aja sedang sapu bersih filter shitcoin luar sana biar project solid tahan
357,udah jelasin kan mudah bikin cryptocurrency sendiri ico jadi media investasi ngumpulin dana tidak banyak ico bener ico cryptocurrency tidak bener sering sebut shitcoin
358,btc eth cryptocurrency market cap besar kalo salah valuasi btc aja sekian persen pasar cryptocurrency bayanginsementara cryptocurrency an waktu itu akibat apa smua ngikut prgerakan btc dong semua crypto hargany naik gila
359,point cryptocurrency memang sedang hype ico jamur banyak investor rasa ico adaleh media investasi oke banyak cryptocurrency masuk ico pair sama btc
360,maksud banyak exchange kalau mau beli cryptocurrency a pake bitcoin alur jadi pakai uang fiat idr usd misal buat beli bitcoin btc lalu tukar cryptocurrency tentu
361,eh kamu main bitcoin sama dong gua main bitcoin ethereum nih bitcoin ethereum beda tong dua sama cryptocurrency beda nama sama kayak us dollar rupiah sama mata uang beda kan
362,in the meantime bikin lanjut thread kemarin ttg cryptocurrency
363,alternatif lain masuk pasar finansial trading komoditas main cryptocurrency high risk high return nah mau bahas ya cryptocurrency dong hehe
364,so waktu putus nabung juta per bulan masukin beli saham amanaman aja blue chip aja lalu saya temu jatuh cinta sama media investasi cryptocurrency
365,barting istilah buat gera harga biasa cryptocurrency bentuk kayak kepala bart simpson harga naik ledak tibalalu cendering datar lalu tau turun jauhhhh merosot banyak trader tipu sama
366,silah rekanrekan medan mau ajar cryptocurrency bandung coming soon
367,cryptowzrd mau ajar cryptocurrency sini aja tidak cuma cuan cuan banyak nasihat hidup orang tidak kuliah mulai kerja investasi umur umur udah jadi milyarder
368,indian government reconsiders banning cryptocurrency report
369,public speaking experience nambah lagilagi presentasi blockchain cryptocurrency
370,harga bitcoin naik yuk simak lengkap toko news flash
371,udah lama bikin event finally maret gt cryptocurrency education featuring bandung tes ombak dulusiapa mau
372,sesuai janji kuliah dikit ttg blockchain cryptocurrency
373,if u still didnt investasi in shiba inu crypto coin then u r a fool
374,mau materi event kemarin why should we investasi in cryptocurrency
375,bag istilah cryptocurrency pegang biasa jumlah lumayan banyak contoh expresi i have a bag of xrp tanda orang sebut punya cukup banyak xrp
376,correction koreksi gera harga naik banget correction turun sebentar harga turun banget correction naik sebentar cryptocurrency umum correction koreksi besar
377,blockchain teknologi belakang cryptocurrency isi urut block upa catatandata enkripsi operasi dasar konsensus anggota hampir mungkin bajak aplikasi hanya cryptocurrency juga asuransi supply chain
378,kenal cryptocurrency
379,siap tunggu lanjut thread video main cryptocurrency
380,altcoin cryptocurrency bitcoin juga bilang bitcoin ethereum contoh litecoin ltc ripple xrp cardano stellar lumens xlm
381,coin istilah mudah nyebut cryptocurrency
382,cold storage cold wallet simpan cryptocurrency langsung hubung internet contoh usb tulis kode nya
383,cryptojacking menggu an kode malware apa istilah curi daya komputer orang buat mining cryptocurrency biasa banyak jadi situs download baja
384,orange man bad cryptocurrency good
385,course rencana kan mau launch september oktober pas mau ngerjain nambah materi teroverwhelmed damn banyak banget harus dicover soal saya punya visi orang mau investasi cryptocurrency harus tau ilmu biar mudah tipu
386,mumpung viral ayo cari hasil tambah trading bitcoin cryptocurrency follow
387,selamat datang dunia cryptocurrency nginvest turun juta semalem certainly not for the weak of heart
388,nah biasa orangorang kelas tengah suntuk sama kerja tautau ngabisin uang tabung buat main cryptocurrency tau ilmu no biasa modal diajarin temen cara baca grafik tidak berapa tambah iman kuat uang nambah banyak
389,timbul efek wah cepet kaya nih bitcoin out of euphoria orang langsung terjun pasar cryptocurrencytanpa tau benar seluk beluk a fatal mistake
390,masuk pasar finansial apa mau komoditas fores cryptocurrency tahu ibarat pom bensin bawabawa obor kamu bakal bakar kalaupun untung bakar kamu laku yang bodoh
391,test ombak kalau lakuin market analysis buat cryptocurrency tarik isi analisis teknikal sih
392,habis diskusi sama cco nya tokocrypto inti mau nyoba inisiasi gera edukasi cryptocurrency blockchain buat milenial tes ombak dulu kalau seminar bayar banyak kok commitment fee aja mau gak
393,ke bahas cryptocurrency aja dah btcidr w indikatorindikator tunjuk tanda bullish cukup giur tinggal tembus ema kalau bisa next resistance usd an juta kalau tembus naik teruuusss
394,uang investasi harap bahas bitcoin cryptocurrency
395,laugh in cryptocurrency
398,yakin mau subscribe freshgrad starter pack linkedin cv beasiswa podcasts random thoughtke depan tambah faedah deh kitab kripto series market analysis kenal cryptocurrency cv review series buat ajar bikin cv
