,full_text
401,yuk ajar cara analisa fundamental investasi cryptocurrency crypto class sabtu guys
402,sini mau ajar investasi trading cryptocurrency follow
403,jam depan buka qna session syarat mudah kok cuma consent aja tanya jawab post sini atau youtube ask me anything related to scholarship job hunting study abroad investment cryptocurrency fitness
406,lanjut nih spoiler ujungujungnya cryptocurrency
407,hey guys mau ajar analisis fundamental cryptocurrency gak
408,mantap bikin uci apa universitas cryptocurrency indonesia
409,ada online coursenya online learning kelas dasar cryptocurrency daftar ps khusus members telegram materi ada jadi perlu daftar
410,course ada gimana cara prediksi value bitcoin cryptocurrency lain bahkan bikin model hitung this will be awesome
412,nulis mau nampung faq nih kait cryptocurrency sini tanya saya kait cryptocurrency saya balsa via dmmention tanya saya tampung course
413,sedikit gambar bisnis mau buat platform isi bakal buku video podcast inti bikin step by step buat orang masuk dunia cryptocurrency guess what minggu pertama bikin platform super gampang sekarang damn rasa berat banget
414,wah mohon maaf nih alhamdulillah tidak masuk korban bubble malah untung lumayan cryptocurrency sampe kaya sih udah sangat bantu hidup
415,rasa sesal biasa kalau ceritain apa gitumisal cerita pas dulu nepal lihat aurora nyombongin cuan main cryptocurrency ada sedikit ken ke masa lajang
416,not even joking i investasi and trade cryptocurrency not without realizing the risk kenapa selalu tolak orang minta nebeng investasi uang mending kalau takut sama resiko alas tidak ngerti cara daftar platform
418,daily profit for hodling btc since data taken since am utc updated every hour
419,se kuliah cryptocurrency
420,yuk ajar trading cryptocurrency bandung sabtu ilmu dipake buat forex lhobener technical analysis alias baca grafik
421,as covid fears ravages all financial markets the amount of holders grow in the midst of this heres what went down this week in crypto
422,event cryptocurrency nih desember mau tiket gratis loh
424,malem minggu mau ajar cryptocurrency gak
425,syarat jadi afiliasi sbb trading cryptocurrency buat ngasih sinyal punya medsoskomunitas trafficnya banyak misal youtube telegram punya plan bagaimana dapat trading volume tadi nomor
426,guys format kurang lebih begini kenal cryptocurrency awal banget beda investasi vs trading teori cara trading latih trading
427,gak equal sempat sekarang jauh lebih baik modal hp uang sekian juta boom jadi mapan jual baju online modal quota ajar jam tiap hari boom jadi hasil tambah trading cryptocurrency modal fb ig main dropship
428,ajar cryptocurrency mama mostly baca buku twitter udah kaya emang crypto tapi kalau tanya hasil tambah lumayan background keuanganit saya master material science kok sih jadi gitu nothing much just keep doing
430,oke bandung sini suka main forex bitcoin ajar analisis teknikal cryptocurrency yuk tanggal hari sabtu jam siang kuy
431,meme cryptocurrency ada konten edukasi
432,great project with a great future good concept and experienced team guaranteed success i am sure this project will be at the top of the market
433,mau mulai ajar mana beberapa saran video documentary buku bitcoin for dummies buku cryptocurrency trader handbook
435,tahun lebih banyak main institusional masuk industri crypto lengkap klik
436,fud fear uncertainty and doubt rupa segala jenis takut ketidakyakinan ragu sesuatu fud buat harga turun dasar berita buruk bohong konyol media sosial misal rumor itu benar hanya gelembung
437,bicara soal hanya soal lho teknologi juga digu an game sebut game imut nan gemas cryptokitties game hardcore augmentors semua implementasi blockchain simak info lengkap gambar
439,halo sahabat digitalexchangeid sambut hari proklamasi merdeka indonesia digitalexchangeid ada lomba meme cryptocurrency masih hubung digitalexchangeid informasi lengkap klik
440,terbit platform blockchain lacak faktur digital
441,hodler mana suaranyaaaaaaa cek market caps cryptocurrency klik taut ikut
445,siklus pasar tuh kayak gin dasar data hasil mantengin chartgrafik siklus langsung tahun utk cryptocurrency golden rulenya jangan beli pas belief lebih tinggi jangan jual pas depression anxiety
446,sangat excited senang dapet sempat foto bareng bu sri mulyani the baik part beliau mention blockchain cryptocurrency pidato senin kemarin makin on fire to embrace the future
447,bilang investasi asik cryptocurrency jadi solusi apa saya diskusi kemarin masalah income sandwich generation note jadi bukan moda investasi muda banget masih baru kira baru orang d dunia menggu annya
448,lebih miliar crypto curi sejak tahun lapor baru kelompok kerja antiphishing apwg tunjuk triliun usd cryptocurrency curi lengkap klik link bawah
449,g usah trading ndek cryptocurrency investasi ae jangka panjang tahun ojok kakean khayal pgn duik akeh yo kerjo jes
450,cryptocurrency uang masa depan
451,coincodex prediksi bitcoin capai angka tinggi ini di k kurun waktu bulan halving kalau kalian mungkin ini jadi coba comment bawah kasih dapat kalian
452,buka dyoramadan kuncicoin undang speakerspeaker keren sedia bagi ilmu buat semua crypto buah investasi bagus masa depan yuk dengar langsung dapat experts
453,suka banget diskusi soal teknikal sama temen deket sma meski beda genre trader forex trader crypto ilmu teknikal nya mah sama aja kadang minta dapat ini kira kira gimana pun nanya wkwk saling tukar pikir seru sambil
454,hi hara squad gimana nih dapat kalian kalo crypto lokal jenis baru yay nay
455,ukt mahal makin afirmasi dapat bocil crypto sekte ulti nol kuliah anggur tahun gaya mclaren kamu warna apa bos
456,lakers resmi pajang banner juara inseason musim di langitlangit crypto arena gimana dapat kalian guys
457,dapat soal bakal turun bulan april buat tutup gap kalau belum beli untr dia koreksi sampe turun ke tengah gap nah baru saya beli
458,lagi ingin lurus mispersepsi mohon maaf agak kurang tuju dapat bitcoin isolasi crypto nya perlu tahu supply bitcoin di pegang etf jumlah nya sangat kecil ketimbang jumlah bitcoin supply
459,investasi bagus crypto coba dong mau denger dapat kalian muehehe
460,dapat tetap sama sideways akhir tahun nama analisa tidak pasti benar anda analisa salah nyata bitcoin malah terbang ath itu bagus sekali crypto yang nyangkut bakal jemput
461,dapat soal tutup belanda amp investigasi perancis saya wajar tuh negara sekutu si tuh nanti binance bakal fokus negara nonblok negara bukan sekutu si
462,millenial friends kabar kejut binance nih kemarin malam tanggal juni jadi turun tajam koin crypto usai gugat sec binance gimana dapat kalian
463,dapat pak soal bakal naik turun akhir tahun disclaimer on
464,saya ada peluang dapat saya lihat pola teknikal bawah adalah candle weekly bitcoin anda tarik support garis biru tahun ke akan dapat support garis biru area
465,q cerahcerahnya nih gaesmulai bitocin naik sekian trading volume nft mulai naik sampai b terus waktu bullish kemarin kalian ngga tinggal kan share dapat kalian bawah dong
466,mumpung ketemu acara campus jadi sekali tanya gimana dapat soal bakal naik turun akhir tahun
467,akan capai tahun kami dengar dapat kamu bagi bawah
468,apa hukum crypto beberapa ulama beda dapat hal halal ada yang haram kalau sendiri ambil pusing lebih mubah ya simpel halal haram bagaimana cara laku contoh uang halal dapat
469,btc hanya bull trap turun apa akan kamu laku ramein kolom komentar saling beri dapat kita milik banyak referensi
470,janganjangan retas ada rugi paut ancam perintah blokir telegram buat hackers laku dapat kamu gimana
471,ajar crypto dulu sama kaprodi buah kampus semarang beliau salafy katok cingkrang lan jenggot dowo dapat soal crypto tak jauh beda jual beli lain inget beliau paham fikih muamalah juga paham teknologi blockchain jadi kurang bias dapat
472,dapat soal tetap sama
473,apa dapat kalian girls wdyt
474,posisi sekarang cash crypto rencana mau cash crypto hasil naik dapat sama bitcoin masih bisa tapi proses tentu uji banyak support
475,dapat tetap sama kalau ulang katakata di situasi sekarang mungkin ada ngetawain
476,sempat gadang gadang usaha sukses dunia crypto ftx kini alami bangkrut simak jelas konten satu bagaimana dapat cashtrians tulis kolom reply bawah
477,apa dapat mas fatah kait luna turun hari mas
478,mana buat simpan gaji cukupcukup palatao buat investment masuk unit trust main masuk crypto nasihat karut jahanam orang tu ray dalio pesan fikir betulbetul siapa minta dapat
479,work mau nanya dapat kalian dong kalo cowo umur tahun blm lulus kuliah udah ngasilin uang sendiri crypto kirakira pas lulus susah ya dapet kerja soal udah umur gin
480,kalau beli aset kripto diwithdraw apa beda beli aset emas toko emas emas tidak bisa bawa pulang gimana dapat pak
481,tiap orang punya pov nya sendiri jadi sama beda antar tiap orang pada statement bang xrp sendiri punya token sekarang aku bangga beda dapat soal
482,dengar suara hati bukan dapat orang karena tanggung jawab atas bahagia diri sendiri bukan
483,aku cuma mau minta dapat wkwk mana tau aku otak error aku salah kan kalo post proof pas diannounce winner
484,mungkin lunc capai harga dolar beritahu dapat di komentar tonton vidio lengkap nya
485,hello sahabat cr selamat sore sumber berita kata kripto punah benar tulis dapat kalian kolom komen
486,sudah baca dokumen climate and energy implications of crypto asset in unites states rilis white house office of science amp tech kemarin dokumen penting baca investor crypto dokumen dapat
487,retwet tuju dengar suara hati bukan dapat orang karena tanggung jawab atas bahagia diri bukan
488,sushi tf h dapat admin ini dapat dorong buyer level ada indikasi naik level lanjut breakout akan lanjut ke level
489,jp morgan kok udah bagus the fed naikkin bps dimon cek jp morgan pakai acara ngomong dpr crypto is ponzi ah tahu aku rencana ikut nomura pindah kerja crypto dapat bitcoin sini sini k saya mau fokus china bilang perang
490,tanya orang kena kurang lalu jadi dapat orang bagai koreksi jadi lebih baik
491,btc dapat singkat naik btc hari bitcoin sentuh harga atas utk buat naik crypto lbh aman amp stabil lama harga tsb sentuh kalah bitcoin peluang utk turun harga minimal lebih rendah lgi
492,berita baru regulasi aset crypto datang amerika serikat regulator pasar aset crypto amerika serikat sec cftc kolaborasi ancang regulasi produk aset crypto bagaimana dapat member indodax ada kolaborasi regulasi
493,guna mata uang kripto terus kembang rambah bagai sektor industri salah satu industri sepak bola ini beberapa fakta tarik putar bitcoin dunia sepak bola gimana dapat tokonauts komen bawah
494,kalau dapat ethereum mungkin begini pola loh begini ingat tahun tahun ethereum itu eth selesai buat puluh juta fans ethereum sangat nanti momen
495,kemarin bitcoin banting kesitu suasana social media sangat negatif banyak tibatiba rubah prediksi jadi bitcoin dapat orang twitter sudah tampak putus asa bitcoin telah bitcoin langsung loncat
496,dengar dapat orang kamu harus turut pilih ambil turut benar
499,mau tanya kalo tau mau share kalo misal bingung mau tanya dapat misal ragu kamu layak grow up jadi host indo internasional aku bangga
500,bagaimana dapat ceo nya lihat crypto pertama indonesia alami nasib sangat nahas bentuk suport rendah belum hasil terus jebol apa terobos inovasi cripto sesuai ekspektasi pasar jan di cap
501,sol aku bias bearish jadi analisis tidak cocok dgn analisis temanteman abai dapat ttg solana sedang banding eth saya post mei masih harga link reply sila share dapat
502,alexander hptner ceo bursa bitcoin bitmex jelas posting blog oktober tolak uu bitcoin negara amerika tengah cermin dapat yang dapat manfaat status quo bitcoin
503,kau milik dapat milik tekad kuat jangan mengulangngulang dapat rusak
504,buah dapat di musyawarah pakai dapat paling tepat nasihat paling kuat
505,dapat salah sangat mungkin gelincir akal satu orang sangat mungkin sesat
506,dapat lebih baik satu dapat tiga dapat mungkin salah
507,gua kadang ngerti kalo orang paksa bayar buat kolaborasi jaman youtube udah jadi sekarang lihat annya caloncalon jadi di crypto art nft i am so tired of dealing with these fuckers tbh akhir dapat soal kolaborasi sama
508,pasang suamiistri milik tugas masingmasing sama penting dalam rumah tangga jadi beda dapat gesek asa
509,antara hak orang akal masuk dapat orangorang akal dalam dapat
510,zzeru emang ngamatin harga crypto n dapat banyak westerners media soal bagaimana bitcoin pimpin revolusi yadda yadda dosen aku pernah ngomongin apa karna akademisi selalu skeptis
511,pak prof mahfud md mungkin pak salah nutul salah ketik ada hp tombol spasi keyboardnya deket tut titik lampir maaf hanya dapat aja
514,hormat ibadah umat agama larang ibadah salah satu cara cipta damai masyarakat bagaimana mu tuju tidak dapat sebut ikan komentar dan twet hastaq
519,dapat sesat lama sama dua tidak akan ada tekad lenyap lama sama dua
520,indonesia harus bebas pilih peluk agama kita yakin bebas sampai dapat bebas organ bagai turut bagaimana kondisi indonesia sekarang ikan komentar twet hastaq
522,indonesia harus bebas pilih peluk agama kita yakin bebas sampai dapat bebas organ sebagainyamenurutmu bagaimana kondisi indonesia sekarang ikan komentar twet hastaq
524,dapat perihal tinggal sakit
525,dapat kamu sendiri mungkin sih mata uang digital ganti mata uang konvesional
526,kabar gembira ceo nasdaq adena friedman menyakini mata uang crypto masa depan uang dunia buat mekanisme bayar lebih efisien amp tepat masa depan mata uang dunia kalian tuju dengan dapat ceo nasdaq
527,teliti bitmex dapat banyak hash rate dua sisi perang hash bitcoin cash telah sewa sejak fork
528,dapat kamu pacar beda yakin gimana yang sih akhir cuma pilih lo h
529,kalo punya temen deket suka minta dapat stlh kita kasih dapat ngga duli dapat tsb e nya diapain ya iyain aja
530,bagaimana dapat kalian meni usia tua emang masalah apa siiiihhh biarin aja sihhh mau nikah muda kek mau nikah tua kek penting rugi pihak mana yakan heran deh selalu urusin urus harus jadi u
531,apa dapat kalian
532,nemu tadi bagaimana dapat mu bg sableng
533,jangan biar dapat orang batas sukses
537,dapat salah sangat mungkin gelincir akal satu orang sangat mungkin sesat
538,dapat lebih baik satu dapat tiga dapat mungkin salah
539,antara hak orang akal masuk dapat orangorang akal dalam dapat
540,dapat sesat lama sama dua tidak akan ada tekad lenyap lama sama dua
541,hujan malam minggu gimana dapat kalian
542,kau milik dapat milik tekad kuat jangan mengulangngulang dapat rusak
543,buah dapat di musyawarah pakai dapat paling tepat nasihat paling kuat
544,sablengers sore aja nih besok selasa rasa senin gimana dapat kalian
545,bahkan selisih kami selalu punya dapat ketika selisih masalah harus diseleseikan itu
546,apa dapat lo sama orang dadak pinter pas nonton debat paslon gubernur
547,cewek sering nanya dapat cowok soal tampil sebenernya cowok betah jawab tanya kayak gitu
548,orang minta dapat kasih masuk ngga mau terima ngga mau kalah argumen gimana nih e nya
549,dapat seterah mau terima ngga twit ngga bayar cuma keluh kesah sama ada negeri carut marut
550,persen orang derita allodoxaphobia takut dapat orang
551,sekali hate delisa cari ke ujung dunia
552,breaking ceo blackrock larry fink kata emas digital amp fink kata emas digital
553,pov jadi holder manta sama punya beberapa ide
554,semua orang gaung meme coin super mega cycle tidak yang bicara meme coin super mega bear market
555,btc yahh kurang dikit bapak btc
556,breaking mtgox resmi umum mereka lunas kreditor
557,capek kuliah lebih e fokus crypto kuliah cuma dapet gelar main crypto dapet duit
558,lokal india
559,hukum paling berat koruptor bukan kurung penjara miskin kurung tetap bayar penuh gaya hidup ketika gaya hidup tinggi kemudian paksa hidup miskin sangat pedih
560,breaking cnbc bahas mungkin perintah as pegang mata uang cadang
561,breaking etf spot as tarik arus masuk lebih miliar lama minggu akhir
562,maaap crypto aku alih emas aja pusing klo crypto
563,bang edit
564,sabtu yah nongkrong warkop biasa
565,ajar analisa teknikal bisa paham gera harga bro jadi trading crypto lebih mudah pas lihat chart
566,breaking aset kerja baik sejak
567,beberapa akun ig crypto exchange luar bisa akses ip indonesia akun ig based in indonesia ada legal request kominfo kalo buka akun ig judol sih aman
568,breaking joe biden dukung kamala harris calon demokratis pilih presiden moga trump pilih
569,blz dalam pantau tren bearish
570,gm singapore
571,joe biden desak dukung regulasi kripto milu as
572,commonwealth bank australia batas nasabah beli crypto aud per bulan undangundang resmi untuk jaga likuiditas bank apa dapat kalian tonton video lengkap full video
573,snd genesis battle pass nft selesai task nya claim hold wallet follow amp like twitter post batas super allowlist snd battle pass nft guna link okx
574,cakep cuma ribu aja
575,ritel gocek
576,naik atas
577,breaking naik atas
578,donald trump bakal jadi bicara konferensi bitcoin besar dunia
579,ganok arep seng kerjo nang web ki kaya kaya sekarang yah orang dasar orang indo males wkwk
580,yang rebound
581,viral detail loss nya apa sama sama tau tunggu next information makanya mental lembek jangan main crypto brother mending sekolah kuliah ngaduk semen
582,warga twitter hobi memang antem segala didebatin sampaisampai antem adu urat jempol vibesnya kaya facebook tahun an janganjangan antem sebenernya orang sama orang suka antem facebook zaman an
584,moga sekarang sadar analisa teknikal scam analisa fundamental scam ada ilmu selalu relevan market market benci tidak pernah pihak konsensus sosial market butuh tumbalkorban baru bullish sumber disensus
585,outlook btc btc sekarang now what long sekarang ken cutloss nyangkut cutloss sekarang btc k dulu isi fvg gap cme beli altcoins lagi jika harga konsolidasi di k otherwise bakal lanjut ke k or
586,tipe ct indonesia alpha ide original awal berani prediksi arah rian alpha man beta main aman amp konten translete knowledge only takut dibully kalau salah prediksi ikut ikut latah beta soy boy tag ct alpha amp beta versi
587,bajing tolong jauh tidak mau rumah sakit ke dukun indonesia
588,gw share coin potensi x sekarang
589,itu yang perlu lo hindar bang jangan main future leverage besar margin besar jangan sembarang klik link approve contract jangan beli meme dex kalau lo paham sistem
590,bayangin seluruh rakyat indonesia bareng beli koin meme solana pas marketcap bawah k nila rb pas udah marketcap billion semua profit x uang rb jadi rp seluruh rakyat kaya raya keren sih
591,sejarah besar mulai
592,duduk nya tenang pikir perang
593,akun crypto a jadi siap nabung rutin harus diversifikasi crypto a lanang moga kalo sdh dewasa rafaeyza smart money bidang apa amiin
594,waktu a nyala puh sepuh
595,sungguh untung mata sang cipta ada baik sia sia
596,orang jangan kamu tanya tanya siapa teman orang contoh teman
597,emmmm sedap
598,sederhana tuhan saat aku puncak bantu aku sampai puncak baru
599,pernah dengar relasi kalah pintar makanya orang sukses terlalu pintar hasil
600,wongwong sukses iku duwe konco nanging dee duwe jaring seng kuat mergo luwih penting timbang
601,bitcoin halving jadi dompet sudah isi banyak crypto apa mau nonton samping mau ikut partisipasi kali
602,orang sadar hal ubah suatu nasehat ubah suatu jadi catat amp tanda mulai maret akhir apa akan hendak maha kuasamanusia bisa prediksi analisa eksekusidiluar sudah bukan kendali manusia moga berkah
603,mata terus amat otak ku terus menganalisa lihat tahun depan moga tuhan hendak nyala
604,orang beri banyak nasehat arti telah laku banyak gagal percaya orang terus beri nasehat sejati tuntut tuju hasil
605,happy semua hari adalah sejarah bitcoin pizza day hari saksi ajaib bitcoin tukar dua keping pizza mei situ bitcoin ubah sekadar wang digital jadi fenomena global ada akan
606,thn lalu transaksi pertama bitcoin beli box pizza lihat harga bitcoin percoin sekarang jalan satu cara cari kaya cari altcoin tiap bullrun th sekali amp tepat tahun iniyang kaya tambah kaya
607,semua da instan insyaallah cetak banyak a muda jutawan amp milyader baru tahun sudah terjun bidang amp mau ajar tahuntahun kemarin masuk tahun tengah siap jadi exit liquidity
608,diri binance cz dapat bulan penjara meski hadap masalah hukum serius kabar baik binance industri crypto adopsi crypto makin mantap bagaimana dapat kalian full video
609,mc mb realistic nyala lah
610,bukan tipu benar terimakasih buat development sehat selalu buat kalian ingin lihat transaksi lihat arbitrumscan
611,yang dunia
612,siap
613,awas gk lengkap
614,dulu nya hujat crypto scam fomo bahkan hampir di bolehin crypto masuk indonesia skrg ngambil pajak crypto negri sehat
615,jawab nya crypto
616,investasi dibedain ama crypto mksdmu crypto bukan imvestasi
617,asiap
618,ga salah sih muda melek investasi biar kayak ane dulu beli btc kena tipu dark web nah bro bro butuh minimal tahun buat paham bahasa bahasa market crypto barusan lihat fyp post an tiktok bro bro ulti nol
619,keren kan tau traceable n transparent soal kalo cuci uang tidak pake crypto gmn
620,mampir
621,ganti bos
622,langsung
623,mampir abang
624,ganti mampir
625,gas bang
626,balik
627,mampir
628,awas komplit
629,udah tak komen takfollow mampir
630,bismillah done n wml
631,fuckkkkk salah tranfer crypto akh
632,mampos dah hold ghzli
633,crypto buat orang banyak duit
634,wkakakakakakkaa
635,semua juang korban hampir serah tipu orang hampir down jatuh bangun saat yang juang crypto pantang serah terbang sama supermegacycle nyala bahagia orang tua amp keluargasisih kan a yatim fakir miskin
636,part posisi per apr moga kawal baik
637,part bgb lg distack next banyak bgb hbar dulu
638,do your own research crypto boleh ikut saran orang karena market unpredictable
639,bisa conect wallet
640,klub paling tolol dunia
641,rb usd dpt apy brp bos kl earn triv
642,iyaa butuh internet udah explore semua teknologi crypto blockchain udah baca jurnal secure and internetless connectivity to a blockchain network for limited connectivity bank users hayo jangan ngawur ahh shitcoin jangan banding emang buat fun aja
643,edukasi bangun cryptoneuz
644,kan dah cuan pas copid yaa
645,biar kalo rugi salah siapa sekali investasi crypto seperti mau naik roller coaster bikin jantung saran cukup gu an rb rb sisa rb biaya transaksi okay mulai punya akun cex
646,thread semat akun nya betul sangat bantu paham crypto dasar sekali para mula bingung mulai mana
647,bingung guys wkwk masuk sering nonton konten windah kapan windah bahas crypto maaf jangan marah guys saya beneran tau
648,akademi crypto gbk rame bener arah tuju hotel mahal semua
649,wkwkwk poko akun crypto gitu dahhh ada nge quote twit aku coba tanyain sebenernya apa
650,yang percaya crypto emang
651,hi bro n sis airdrop pepe via tele silah sedot
652,kena hack upa modus tipu crypto untuk dua kali akhir kali tahun akhir yang channel resmi baikbaik aja ya balikin channel dua mula
653,min channel youtube jkt tv kena hack upa modus tipu crypto nanti kalo para langgan membership tidak nonton live premium hari gimana
654,free airdrop cukup register dapat token for free smartcontrak rilis hari
655,dapat upt token guna kuota internet hari register dapat token pertama cukup isi email sajja link register
656,kisah cryptocurrency dfa coin rusia part
657,kisah cryptocurrency dfa coin rusia part end
658,kisah crypto bas syariah islamic coin arab part end
659,indonesia catat lonjak investor crypto transaksi tembus rp triliun iisal
660,kapan rilis kalo tai apk pintu token crypto islamic coin
661,da nang is the next canggu
662,arti logo rampok balik harta jajah lalu market global dunia bagi hasil fakir miskin a yatim piatu cita cita raja crypto indonesia salut kalian
663,ramadan mubarak brother
664,kasus curi amp tipu crypto aset milyar rupiah
665,akun personal bukan buat crypto cuma kdang tweet inti sad dulu skrng
666,uak ramal horoskop crypto minggu simpang astrologi blockchain iisal
667,azure wallet gandeng visa revolusi bayar crypto tembus batas tradisional iisal
668,tukar probit global gandeng mineable inovasi tambang crypto ramah lingkung iisal
669,temen mau nambah skill biar trading crypto mumpung skrg lg bull market lgsng dm akyuu
670,apag na ba ang lahat kahapon
671,hari sejarah crypto sinar
672,minta alamat email daftar kak dari team akademi crypto
673,halo kirim alamat email daftar akademi crypto dari team akademi crypto proses tesebut mohon maaf atas ketidaknyamanannya
674,terimakasih
675,gila crypto lgi bagus bener
676,tg only username tg sitiaisah name tg siti aisah
677,tg only username tg sitiaisah name tg siti aisah
678,done all step username tg sitiaisah name tg siti aisah
679,done all step usermane tg sitiaisah name tg siti aisah
680,hari galau investasi stocks lokal us crypto
681,ice daftar iceusdt dagang buka utc februari gabung menggu an kode referensi caksur
682,nonton crypto arena kayak sulit tidak mustahil moga suatu nanti
683,dulu diajakin crypto gamau kekeh parlay slot gilir sekarang btc to the moon ngikut borong btc fomo ah
684,xaccfffdafceabdfcdaec
685,bcqyaeuhsnffqkcdnjahpyaprsjgggdspml btc address
686,bismillah moga untung
687,tidak beli crypto mana karna tidak paham dngan biar tetap jadi tonton tuan
688,thn banyak jutawan amp milyader muda muncul moga kalian salah satu aku bilang tahun yng terjun dunia crypto tahu bulan amp tahun jadi nya naik bbrapa trjadi naik crypto supermegacycle ilmu padi
689,rating terus terus turun yes yes yes moga musnah ice dunia cryptobikin neg lihat nya
690,twitter lihat tuh akun investor kyk dr sp bucin ken putar for the sake of market bukti abis milu market ijo baik di maupun crypto
691,selamat ulang tahun indodax ke moga indodax makin sukses makin maju moga jadi exchange no makin jaya masuk exchange top global jadi platform baik exchange cryptocurency global jadi tempat transaksi crypto mudah inovasi a muda
692,verifikasi akun di nama panggil kkarti ajar lebih lanjut masa depan desentralisasi bangun
693,knp panggil tarik bahas crypto
694,verifikasi akun di nama panggil rojab ajar lebih lanjut masa depan desentralisasi bangun
