,full_text
695,verifikasi akun di nama panggil ebiel ajar lebih lanjut masa depan desentralisasi bangun
697,salut suhu crypto humble ngasih ilmu info bahkan manajemen resiko dicrypto rubah mindset trading investasi pr nya sekarang
698,bocor regulasi pajak crypto
699,punya segitu aku masukin defi bang bangun porto crypto lalu defi defi buat aku pondasi bangun portofolio defi aku bangun value modal bawah loh cara gimana wah kelar hari slsai jelasin wkakak
700,bukan orang rubah ada tapi diri sendiri harus sadar kalau sekarang bukan waktu yang tepat terus mau sampe kapan kyak gin
701,santai jogetin aja
702,banyak nyerang mu dokter palsu minat masyarakat tdk sedikit kurang surve malah naik
703,modal juta jual sekarang beli iphone pro max jual beli mobil iphone pc gaming tinggal pilih mau mana
704,ajar crypto currency sama praktisi jerman lancar bahasa indonesia nya yang cuman jago bahasa jerman lumayan tambah wawas bitcoin ekosistem nya let me understand first before playing bro
705,verifikasi akun di nama panggil ansory ajar lebih lanjut masa depan desentralisasi bangun
706,verifikasi akun di nama panggil kancil ajar lebih lanjut masa depan desentralisasi bangun
707,kalian milik kendala sama apa bicara tim inti ice tulis di bawah
708,jatisrono
709,gu an taut gabung mulai tambang game dot amp play untuk menang ace gu an kode undang sayasantosowibowountuk dapat tarif dasar jam statistik langsung transparan
710,halo partisipasi proyek crypto besar ikut gabung alterprotocol menggu an kode ruhmxn anda juga klik taut untuk daftar
711,gm kermit
712,keblinger kuasa muslimat nu giring
713,verifikasi akun di nama panggil ichihara ajar lebih lanjut masa depan desentralisasi bangun
714,paklangcom
715,spot trading sekarang buka iceusdt trading sekarang gabung tim di menggu an kode referral sultancryptobarokah
716,verifikasi akun di nama panggil rivala ajar lebih lanjut masa depan desentralisasi bangun
717,verifikasi akun di nama panggil manin ajar lebih lanjut masa depan desentralisasi bangun
718,spot trading sekarang buka iceusdt trading sekarang gabung tim di menggu an kode referral farikhul
719,verifikasi akun di nama panggil yulius ajar lebih lanjut masa depan desentralisasi bangun
720,verifikasi akun di nama panggil kangmas ajar lebih lanjut masa depan desentralisasi bangun
721,ad spam mulu tidak sih diilangin males banget udah asa iklan crypto
722,verifikasi akun di nama panggil darwis ajar lebih lanjut masa depan desentralisasi bangun
723,ada ubah signifikan up bulan sekali
724,porto spot kalo ngoceh kaya profesor crypto udah mulai pedot wkwkw copy trade takut kalo kamu jago juara tanding bukan ngoceh mulu kwkw
725,tiongkok larang dagang crypto yuan sepenuh ilegal cuman mau ingetin ajah hati buy pucuk banyak fud
726,gua janji sama diri sndiri brthun vakum brhnti rokok ntar aku ngrokok lgi pas nympe juta prtma dri crypto next juta smpe strusnya baru aku ngrokok korelasi yah biar tiap hisapan bayang porto makin naik bukan bayang hutangcicilan sana sini
727,lia safitri
728,kalo kamu jago crypto tidak pake utang bank bunga per tahun tahan tahun arti bunga sedanhkan profit btc x arti k arti cuan ada sisa coba tanyain vip kamu tidak berani kwkwkwkw jurus ngeles
729,bcqgwgksgceklekxezyhaqjgxmvqmj
730,alhamdulillah nikmate gusti
731,lu dah dapet apa ajah crypto
732,kemarin crypto sekarang judi online gua
733,paksa withdraw buat bayar roadtax laju je masuk so next year kene plan saving bayar roadtax investasi dekat crypto
734,beli bitcoin tahun btc aja cukup
737,tahun bitcoin scam regulasi ketat tahun semua bitcoin belum sirkulasi harus tambang america dukung selfcustody amp tolak cbdc butuh trump balik trump butuh dapat dukung milu usa
738,pi network koin kripto independen node saing bitcoin ethereum
739,elon cyberpunk musk
740,tuju nashville pasti unjung di booth bicara bitcoin beli merchandise lorenzo baru
742,bagus bitcoin jadi makin sehat tingkat kepwrcayaan masyarakat jadi lebih baik bitcoin utama baby boomer tua tui jadi tenang investasi btc
743,terbit lpt yat lorenzo bangun fondasi ekosistem defi bangun dasar standar token hal mungkin cipta produk defi lebih kompleks menggu an stbtc yat lanjut eksplorasi mungkin dana bitcoin
744,november sy mas inget betul banyak nungguin bitcoin k
745,penting knowledge nyata makin banyak bicara lokal putar bitcoin aura makin serius sih bicara pak ton yt channelnya bahas instrumen uang tabung
747,ga perlu repotrepot nyari altcoin buat gain x x x cukup dca bitcoin history repeat itself tahun tahun tahun semua sama
748,rugi rana curi elektrik bitcoin rm bilion lagi curi lain raja laksa an agenda alih tenaga rana cari sumber tenaga baharu elektrik sedia yang tiris kita kena kekang
749,terima bitcoin mtgox milih ngehold bitcoinnya mereka yakin bitcoin bullish wen moon ser
750,bu sabah kripto
751,peluang menang trump makin besar harga bitcoin terbang
752,adopsi teknologi bayar baru dan selalu warna skeptisisme
753,info eksklusif buat member vip tiga koin kuat satu koin umum lain rahasia vip bitcoin turun k k lalu k koinkoin tetap kuat pola higher low full video
754,achei um hub bitcoin hahhaha
755,kalau bitcoin nyampai maret aku live stream minum cangkir kosong ada reward rp juta salah satu subscribers subscribe youtube ig tiktok menang full video
756,selamat datang member vip baru waktu sempurna buat beli koin cek daftar koin usah pikir panjang indikator peduli saat ethereumdogecoin murah banding bitcoin waktu baik buat beli full video
757,fiat dolar sebut scam besar banyak orang mulai alih bitcoin bank punya kuat hukum batas beli bitcoin amerika habis uang pajak konflik luar negeri apa dapat kalian full video
758,aset besar dunia pola pikir
759,jangan langsung percaya influencer bilang bitcoin bakal kalau beli bitcoin cuma rugi mending beli meme coins turun full video
760,is dell the next microstrategy orang kaya dunia
761,prediksi akurat kemarin channel bilang bitcoin drop karena gamestop turun jelas ngerti gerakin pasar market makers broker liquidity providers full video
762,ragu bitcoin turun youre kidding sempat emas akhir wall street institusi besar manipulasi harga etf peluang cuan besar full video
763,mei saat beli alt coins bukan bitcoin old season dekat banyak alt coin diskon gabung vip telegram untuk pandu lengkap update live siap profit besar full video
764,hasil beli bitcoin murah banget banyak koin diskon besar kemarin tugas aku buat member vip yakin sekarang saat yakin meski harga murah psikologi pasar bikin ragu full video
765,ingat koin trump dulu sekarang naik x lipat prediksi meme coins naik lebih cepat awal siklus altcoin season bitcoin halving jadi mulai akumulasi sekarang full video
766,channel bilang bitcoin alltime high baru juni kita udah warning juni kalau bearish short term beli pada desnov fokus puncak siklus drop serok full video
767,flexing time prediksi bitcoin dari juni bukti super akurat juni jam pagi chart bitcoin beneran turun yang bilang yuk cek bukti siapsiap cuan full video
768,bitcoin update fakta tarik btc konsolidasi more less hari panjang april september chart atas proses sama down corrective up impulsive drop again sama konsolidasi base skrg chart bawah tidak jadi patok cuma sama
769,part upgrade cvt matic cek harga promo khusus bagai part modif motor original lewat link bawah shopee tokopedia lazada
771,percaya usaha muda tidak duit punya uang dikit bagi beli aset kemudian uang udah lempar aset a b c udah suruh kerja uang nya pandai lah putar kan uang
772,buat skeptis lihat bukti nyata investasi vip telegram member hasil profit hingga contoh switch bitcoin ether lonjak real community real results gabung sekarang full video
773,beach walk hari sangat senang jumpa bulan depan our bitcoin beach walk today was lots of fun see you again next month
774,gak semua orang jadi trader semua orang jadi usaha semua orang jadi investor
775,ojo mentas sakdurunge tuntas ojo leren sakdurunge panen ojo nyerah nek ora ken urip susah gus kok hd
776,wah halving bitcoin depan mata apa iya smua market bakal ijo smua duh fomo bisa kalo beli skg wah marketnya lejit nih jual skg apa hold dulu ya nahhh semua tanya putar halving galau kriptopers akhirakhir bakal lik
777,ada ilmu padi adu ilmu jembt tak lihat kembang
778,riot platfrom inc usaha tambang bitcoin hampir gapernah deviden investor gua beli nya but im sure this cycle is different it doesnt matter if im wrong just using have fun money
779,pasu bukan usaha ges kemarin cairin bitcoin
780,jom tukaq bitcoin
781,hewan mirip penyu apasih purapura
782,anda nya saldo bitcoin ku di ambiludah jadi naga sekarang
783,bitcoin vs emas tarung investasi era digital iisal
784,pilpres biasa aja klo bitcoin oke
785,komparasi ihsg bitcoin
786,citrea inovasi baru skalabilitas bitcoin iisal
787,bitcoin emas perak lindung investasi tengah gejolak ekonomi iisal
788,ethiopia sinar destinasi baru tambang bitcoin global iisal
789,mana peduli bro sing penting joget bos
790,masalah kena stunting rentan kelompok mana kelompok kelas bawah alias cap susah tadi jadi sama aja jatuh sasar tetap kaum kelas bawah
791,labur kripto pelabur
792,selamat raya isra mi raj nabi muhammad saw moga indonesia damai makmur adil lindung aamiin
793,bitcoin kuat
794,bitcoin aku mau beli mobil innova diesel putih
795,pssttada hadiah bitcoin hingga rp juta bisa kamu menangin yuk install ajaib kripto kode ajaib anan dmulai jalan investasi kriptomu terus hadiah klik sini
796,verifikasi akun di nama panggil lutfil ajar lebih lanjut masa depan desentralisasi bangun
797,verifikasi akun di nama panggil tmy ajar lebih lanjut masa depan desentralisasi bangun
798,nunggu bitcoin banting cuman bilang mati masuk rndr
799,aku baca hah hayday apa restoran hah trade trading bank bitcoin forex hah gandum tukeran gandum astaga game wkwkwkwkw
800,verifikasi akun di nama panggil muhamat desentralisasi bangun
801,pssttada hadiah bitcoin hingga rp juta bisa kamu menangin yuk install ajaib kripto kode ajaib cokrdqg dmulai jalan investasi kriptomu terus hadiah klik sini
804,verifikasi akun di nama panggil aditamaputra desentralisasi bangun
805,tambang bitcoin pak maksud
806,verifikasi akun di nama panggil yad ajar lebih lanjut masa depan desentralisasi bangun
808,mulai ajar etf bitcoin turun luncur spot bitcoin etf
809,simpleng data pero gem nila to alam tara samahan nyo kaming manood ng live
810,emang tidak mau nih hadiah bitcoin hingga rp juta bisa kamu menangin yuk install ajaib kripto kode ajaib ahmarqv dmulai jalan investasi kriptomu terus hadiah klik sini
812,verifikasi akun di nama panggil rasihr ajar lebih lanjut masa depan desentralisasi bangun
813,kejut lihat youtube bang siar pangsung bitcoin rupa sdh alih kepemilikanplaylist sih nagara istitute patra video sudah ilang
814,game lagi viral pragmatic
815,kakek zeus ribu ngasih petir merah biru
816,tinggal tidur aja
817,kamu loh pakai tripod stand jadi agam fungsi promosi bisnis pajang fotobarcodeqris tunjuk arah papan informasi promosi dapat tripod stand sekarang klik link bio
818,verifikasi akun di nama panggil raden ajar lebih lanjut masa depan desentralisasi bangun
819,verifikasi akun di nama panggil tahir ajar lebih lanjut masa depan desentralisasi bangun
820,verifikasi akun di nama panggil jazaulaufa ajar lebih lanjut masa depan desentralisasi bangun
821,kita punya citacita finansial baik merenca an sebut baik laku beli keluar impulsif
822,kalo elizabeth stark aja semua wanita bisa
823,mamih inces ngasih kejut petir merah auto jp puluh juta
824,wanita lahir besar brooklyn san francisco datang dunia kripto guncang segala
825,aku kalau bio ada bitcoin mmg any point he makes is sampah
826,promo makarizo advisor hair murah
827,kak sentimen naik bitcoin btc ini pengaruh the fed nya amerika mulai landai turun suku bunga tahun mohon cerah
828,prediksi dan lihat sama tahun ini banyak cetak jutawan baru milyader baru dunia tahun juang
829,pasuk fase halving mulai mei bullish uptrend langsung jadi biasa bullrun akan jadi bulan bitcoin halving anda siap halving bitcoin sempat hanya jadi sekali thnbullrun benar
830,ini prediksi lihat sama tahun cetak jutawan baru milyarder baru ath baru jadwal tahun merah november cycle top jadwal lama hari mulai tanggal november
831,beli bitcoin ah eh turun
832,pasuk fase tanda ini fase segera mulai
833,klo gitu berani ya lah apbn indonesia investasi bitcoin bumn buat usaha bitcoin bank bumn investasi bitcoin ikan pinjam produktif kpd nasabah utk bitcoin
