,full_text
0,bitcoin kontol anjing biadab moga mati semua ente kena ledak bubble hancur
1,bitcoin turun tuh
2,bi bitcoin rupa alat bayar tidak sah
3,bitcoin naik gila turun tiba riskan gitu
4,selamat pagi selamat akhir pekan harga bitcoin hari alami cukup banyak turun di pasar altcoin xrp nxt alami turun ini waktu beli bagaimana anda d
5,baru beli bitcoin dekat atas tu hari lalu mesti tak senang duduk hari ni habis kau
6,beli bitcoin banyak banyak itu bitcoin hilang
7,muskil memang bayang buah cryptocurrency terima semua sektor industribisnis tren ini tiap komunitas sektor bisnis bikin cryptocurrency sendiri misal komunitas ebay global bikin sendiri komunitas design grafis dunia bikin sendiri
8,malam baca ciked ciked cryptocurrency manjang viral harga bitcoin naik dadak borak lah takda function
9,oke pikir buka kursus semi privat buat mau ajar trading cryptocurrency minggu x di bandung dulu yang minat ya
10,kemarin ketemu milik salah satu usaha cryptocurrency besar indonesia lalu bilang wah kalo kamu tau kamu kan main lama see thats how far years of persistence can take you not necessarily persistence mostly shitpost and meme
11,kenal snapex tempat kerja platform margin trading cryptocurrency see more at
12,umur ken s s ken s lalu jadi dosen apply phd dapetdapet kerja pertama ajar crypto ken jadi sosok jadi expert hal cryptocurrency indonesia habis baca manga ken jadi fighter sekian kerandoman hidup aing
13,seperti kalau sharingsharing edukasi mula materi basic blockchain cryptocurrency web industry materimateri lain seru kali
14,apasih beda nya layer cryptocurrency layer fondasi suatu sistem blockchain tangan transaksi dasar sending making amp burning tanggung jawab atas aman lanjut jaring blockchain contoh bitcoin ethereum solana
15,crypto haram islam pandang kena cryptocurrency debat ada beberapa alas cryptocurrency anggap haram utama majelis ulama indonesia mui gharar ketidakpastian nilai crypto fluktuatif tidak dasar aset
16,lagi main game isi sejarah bagai aspek dunia seru sih sambil ajar nah topik sejarah uang bahas barter ke blockchain ni game usaha netral tidak nyebut cryptocurrency apa kalau baca jelas
17,belum pernah join pepe gua coin orang cepat syarat bisa klik link bawah
18,buzzwords web blockchain biasa cryptocurrency nft yes buzzword walaupun datang cuan banyak noda sama bagai scam hack ponzi rugi besar lain tau kalau web blockchain lebih itu
19,berpadapada promote crypto hype produk dulu pergi xx capital conference makan satu meja orang belah ria promote join cryptocurrency layan fuh cerita semua return je bayang nasib orang terima bulatbulat literasi
20,cryptocurrency topik paling panas tahun sekarang udah mulai lelep overall market drop rata investor retail indonesia udah mulai kapok banyak berita cenderung negatif kaya gin terus masa depan crypto udah mati a thread
21,bitcoin cryptocurrency kapital besar dunia alami naik signifikan pek nilai roket hingga digit tepat pek akhir
22,renzo rez binance research rez rupa buah liquid restaking protocol mudah guna staking cryptocurrency ethereum eth renzo protokol mudah guna staking cryptocurrency ethereum eth renzo hilang kerumit
23,jadi masa depan cryptocurrency mungkin letak sama sekali finance di seluruh ekosistem web the new version of internet hal lagi betul kerja talent handal dorong visi decentralized open internet
24,video kama hizi ni mhimu sana kuzingtia kufuatilia na kujifunza kitu cha msingi kwa ajili kujiongezea kipato hii ni full course yenye manufaa
25,mulai masuk masa mana orang kaliber tinggi bahas cryptocurrency anti sama crypto tidak paham banyak salah konsep paham crypto web orangorang kaliber sangat jago respected bidang paham
26,mobee pop up quiz siapa pertama kali kenal konsep cryptocurrency
27,seperti jabat menggu an ilmu santet biar kembali kenapa pilih bayar jenis coin crypto monero hacker sering pilih cryptocurrency monero xmr monero rancang beri tingkat privasi tinggi guna
28,apa alamat cryptocurrency alamat identifikasi unik digu an kirim terima rangkai huruf angka wakil tuju tiap transaksi lebih paham
29,benarbenar ramah lingkung ingin dengar dapat ikan komentar bawah gabung cakap
30,berita terpopular sangkut ethereum pek masih agam mulai prediksi harga eth tahun hingga mampu ethereum
31,jaring tega jahat uang as fincen buah biro departemen uang dapat binance kait platform cryptocurrency ilegal bitzlato
32,bitcoin cryptocurrency lain koreksi hari senin kemarin aset kripto lonjak level tinggi sejak agustus lama akhir pekan
33,ceo jpmorgan jamie dimon bahas pikir suku bunga bitcoin turut federal reserve ini perlu naik suku bunga perlu lebih tinggi
34,menteri uni emirat arab thani alzeyoudi kata crypto pegang peran penting dorong dagang lebih lanjut negara sebut
35,francois villeroy de galhau gubernur banque de france dorong standar atur lebih ketat usaha cryptocurrency prancis ini tuju tanggap volatilitas gera harga industri kripto crypto winter baru jadi
36,rohit nih bos senggol dong andi p
37,januari cipta bitcoin pseudonim satoshi amoto tambang bitcoin pertama sekarang kenal genesis block enam hari rilis awal perangkat kamu bitcoin luncur jaring cryptocurrency
38,china luncur pasar nft nonfungible token pertama kung perintah negara ada ini jadi tanda baru terap teknologi duduk area abuabu legal atur negara yang kenal ketat cryptocurrency
39,ndo wkwk sesuai apa ken
40,ndo kalau emang k kuat naik malah turun mungkin k harap akhir bikin naik moga aja turun lebih k cuman apadayanya retail kecil tau hanya whale punya big data
41,berita departemen hakim as sita sbf ada robinhood
42,apa bonk inu bonk koin meme shiba inu versi solana
43,adapun beberapa koin menggu an fitur privacy coin ini monero xmr zcash zec dash dash
44,bahahaha
45,hanya kerja balik layar kini perempuan bisa terjun langsung lapang kerja hasil karya sendiri
46,reminder buat udah cuan take profit berapa persen tulis pnlnya kalau realisasi wd bank kalian tidak jadi uang rasa bisa naik dari sini minimal jual aja bagi dulu aman uang
47,cinta komunitas gabung kami telegram bersenangsenang lebih banyak arpa
48,ndo lihat timeframe jam btc lewat k mungkin naik dulu k doa aja bisa lewat k
49,butuh tukang pijat bisa cryptocurrency
50,kata tahun rupa tahun gejolak dunia cryptocurrency kita lihat banyak peristiwa khusus jadi
51,mau ajar cryptocurrency
52,tahun nyari phd tolak bas kali lalu putus udah ah mungkin bukan rejekinya cari kerja d bidang cryptocurrency sekarang mulai rasa settle barusan dapet info bimbing pas thesis buka lowong phd hidup canda hidup dunia hanya senda gurau belaka
53,jadi sedang jalan halaman twitter cryptocurrency telegram temanteman sangat silah gabung sedang mikir panggil buat follower setia apa ahli kitab ahli kripto apa
54,ayo milenial melek investasi investasi cuma sukuk emas loh juga cryptocurrency mau ajar silah daftar telegram minggu pertama gratis
55,hampir seluruh pasok bitcoin btc edar ada dompet bursa cryptocurrency utama akun twitter the token analyst
56,komen tentang cryptocurrency merah komentar negatif kuning netral harga naik komentar positif
57,salah satu moda investasi cryptocurrency salah satu bukan satu sendiri cuma main cryptocurrency jangan masuk semua telor keranjang
58,istilah blockchain memang bilang asing bagi besar orang internet masa awal muncul itu banyak orang bingung bahkan ragu
59,hmmm topik sebar by frequency udah lumayan sering upload tunggu materi cryptocurrency minggu subscribe dulu la
60,harga bitcoin atas juta eh bro ajarin aku cara beli bitcoin investasi cryptocurrency dong aku lihat lihat potensi tarik nih harga bitcoin turun lah kamu main kayak gituan kagak mungkin hasil kamu brooo investasi bodong people are funny
61,beberapa waktu lalu ajak diskusi sama orang tarik sama blockchain giat cryptocurrency tau dikitdikit lah blockchain udah ngobrol kenal basabasimuncullah suatu tanya
62,sebentar pasuk fase mana semua orang jadi jenius kaya cryptocurrency
63,sepakbola sekarang adopsi cryptocurrency
64,bayang dunia digital tidak situs web hancur tidak konten dapat sensor siapa selain milik domain web
65,parlemen inggris cetus ide warga bayar pajak menggu an bitcoin lho eddie hughes anggota parlemen rasa parlemen mulai adaptasi dan revolusi teknologi
66,kalau lihat komen legit gan postingan yang jelasjelas scam tuhhadeh
67,harga crypto naik bagi kalian mau mulai investasi mending beli sekarang deh pantau market caps crypto
68,atur anti cuci uang mulai laku uni eropa
69,opera luncur browser baru dapat dompet crypto dalam
70,indonesia ajar turki banyak situs blokir perintah turki bakal redirect situs isi ads bahkan mining cryptocurrency bahkan situs un sekalipun
71,pihak wenang cina tangkap orang duga laku jahat cryptojacking
72,iran kembang cryptocurrency bank sentral larang tukar bitcoin lengkap klik
73,jumlah prediksi makin terus kurang iring turun harga mata uang virtual sebut
74,reddit henti terima metode bayar menggu an bitcoin image
75,thailand laku pajak cryptocurrency
76,perintah iran token baru telegram rusak mata uang nasional
77,g ada diskusi pisah cryptocurrency minggu depan
78,regulator uang jepang tetap keluar hukum beberapa cryptocurrency exchanges minggu serta tutup bagi
79,presiden venezuela nicholas maduro klaim hasil luncur jual petro cryptocurrency keluar pertama kali negara
80,kumamotoenergy produsen listrik lokal jepang umum mereka menggu an energi matahari tambang cryptocurrency
81,bank indonesia turut manfaat hadir teknologi blockchain jadi teknologi dasar operasi cryptocurrency misal bitcoin amp mata uang digital lain tdk tutup mungkin mata uang rupiah ubah jadi digital read more
82,atur baru sebut paksa tukar mata uang virtual malaysia amanat patuh kyc masuk kumpul dokumentasi id
83,otaku coin cryptocurrency baru para otaku
84,apa tuh cryptocurrency simak ulas
85,fokus artikel atas adalh aspek positif cryptocurrency bukan aspek spekulasi spekulasi malah rusak ekosistem cryptocurrency aspek spekulasi hanya serakah yang arah bubble artikel atas lihat cryptocurrency segi inovasi bukan spekulasi
86,prediksi jadi tren dunia teknologi tanah air tahun simak informasi dasar mata uang digital bitcoin kamu terus ikut kembang klik
87,mata uang digital bukti bikin orang kaya dadak contoh orang mereka jadi miliarder dunia garagara demam cryptocurrency
88,selamat malam smart people jaga yang sedang skripsi ngerjain tugas kuliah boleh istirahat seje nyimak info yang boomingboomingnya
89,lumayan banyak dm nanya soal bitcoin dkk coba buat thread jelasin sini aja reminder rupiah satusatunya mata uang sah indonesia amp bukan expert jadi dyor apa cryptocurrency
90,video jelas jatuh harga cryptocurrency
91,guna mata uang digital atawa cryptocurrency bitcoin etherum ripple makin luas banyak negara merespon legal meski tak sedikit boikot
92,teknisi nuklir tambang cryptocurrency pakai superkomputer
93,kemerleri bagladik mi
94,bursa bitcoin jepang retas bobol rp triliun bursa uang digital cryptocurrency besar jepang
95,gamers kata kesal miners harga vga lonjak pakai mining cryptocurrency siap samsung buat chip no sekarang dunia kabar mensupply chip asic khusus mining pabrikan rusia china
96,coincheck bursa cryptocurrency jepang bobol bagaimana nasib gaji virtual currency girls
97,cryptocurrency baru ratus token ramai pasar
98,perhati media mainstreamlihatlah masif bahas cryptocurrency aman hebat gosah heran arah udah jelas terus klean akan bondong iya tunggu aja sesal
99,facebook blokir seluruh iklan cryptocurrency
100,salah satu cryptocurrency besar bitcoin awal sesuatu hebat mata uang perintah
101,bitcoin cryptocurrency per januari satu bitcoin tara usd naik turunnnya bitcoin sudah sadar guna investor
102,yang minning cryptocurrency menggu an bot telegram gimana
103,menkeu ingat masyarakat gu an cryptocurrency
104,bitcoin cryptocurrency jadi katakata sering dengar akhirakhir yuk simak jelas wahyu anggoro bitcoin dan diskusi lebih jauh kena topik di line bagikata
105,sebut virtual currency tidak sebut cryptocurrency juga masuk uanguangan tempat main timezone voucher
106,kembang mata uang digital cryptocurrency cepat agresif fundstrat global lacak dapat kit
107,bitcoin kontolasu biadab moga mati semua ente kena ledak bubble hancur
108,bitcoin tarik
109,cerah itu bitcoin cara dapat bitcoin dgn betul bagaimana cashkan bitcoin potensi amp profit lalu bitcoin tempat pusat latih levender taman levender heights m a s u k p e r c u m a rahsia bitcoin perlu tahu
110,selamat pagi sahabat digitalexchangeid ikut update top cryptocurrencies periode desember kabar kini digital aset pagi semua harga aset alami turun harga bitcoin turun besar bagaimana kabar aset kamu hari
111,analisis harga bitcoin juli kalau suka upload kayak ginian mohon masuk ya disclaimer bukan financial advice
112,blockchain cardano what in gods name is that buat follow atau dar lihat rtan tweet pasti suka denger pintas kena halhal ikut blockchain cryptocurrency bitcoin xlm xrp btc lain bagai
113,mau asumsi media mainstream kontrol sama elit dunia politis perintah bankir investor besar mau kaya diri dong cerita mereka udah punya crypto nih anggap aja punya bitcoin banyak org mau beli harga naik kan
114,kurang tuju sama nyata klo bitcoin bubble bear market iya bukan belum bubble
115,sarafu kidigitali bitcoin yaporomoka thamani kwa kasi jana desemba bitcoin ilipungua thamani kwa zaidi ikishuka chini usd kwa bitcoin ikiwa ndio thamani yake ndogo zaidi kwa zaidi mwaka mmoja soma
116,kalau punya utangcicilanpakai untuk lunas dulu mau ngasih orang tuakeluarga juga jadi juta ini tiap bulan investasi definisi investasi batas beli beli bitcoin
117,btc short btcusd xbtusd
118,siapa aja sih cryptocurrency ada besar coin market cap silah dicekgoogling ajar websitenya mau ngadain salah satu ini bitcoin ethereum ripple litecoin bitcoin cash eos stellar lumens cardano iota tether
119,event cocok mahasiswa orang tarik development blockchain tuh teknologi belakang bitcoin cryptocurrency sabtu agustus lo ka si jalan juanda no bandung pukul dont miss it
120,pikir beli bitcoin harga juta langsung jadi jutatanpa perhati risiko si juta turun jadi juta
121,argumen kenapa bitcoin layak sebut bubble sekali lg bilang argumen bisa salah dia turun lebih dan jangka waktu lebih panjang waktu lama tabel gambar dua tambah aja buat diskusi heheh
122,lalu harga naik usd jual deh uang jadi usd anggap usd nikmatinlalu pas harga turun jadi usd beli pakai usd ada dapet bitcoin harga murah siklus ulang ulang
123,mending jual skrg rugi total pikir jual jual jual harga makin turun apa laku harga turun para investor elit dunia beli lah harga murah untung besar ibarat beli bitcoin usd beli usd
124,kira sekarang mana di fase harga jatuh nih tipsnya google aja bitcoin news today cryptocurrency news today lihat nih kalo ketik hari di google hasil
125,patut tun masuk mlm kasi setel masalah hutang negara ni tak main bitcoin main forex dulu dah kanto sekali
126,pak jon ken dong nanyalah si boygimana cara main crypto diajarinlah pak jon daftar exchange gimana cara jual gimana cara beli coba beli dulu juta rupiah ke bitcoin besok juta tadi langsung jadi juta keranjingan
127,karena bitcoin dominasi lihat aja market cap bitcoin hampir tengah total kapital lalu semua exchange kalo mau nukar sama fiat nukarnya sama bicoin
128,karena bitcoin udah curi start banding altcoin hampir taun iya mungkin mengeciltapi it takes time skala nya tahun eth xrp mungkin ngalahin btc
129,banyak berita sumber media tidak familiar kan macem coindesk segala saya yakin banyak baru denger lol nah beda saat bulan novemberdesember coba googling bitcoin news december november
130,fud fear uncertainty and doubt berita bikin takut harga jatuh misal berita is this the selesai of bitcoin padahal harga cuma turun fudster orang nyebarin fud
131,lets start nih cerita ya bas coin btc act bcd bch btg eth etc ignis ltc nxt stq ten waves xlm xrp xzc dash doge semua singkat kayak main misal bbca bank bca btc bitcoin eth ethereum
132,regulationgovernments misal nih berita perintah india mau ngeban bitcoin harga bakal turun berita tu fud misal ada atur baru kena pajak main crypto nah bakal buat harga turun naik
133,whale alias bandar misal suatu exchange rb coin misal bitcoin orang banyak cuma punya bitcoin nah orang punya bitcoin bisa mudah nyetir harga jual bitcoinnya aja turun drastis tuh harga
134,arbitrage ngambil untung beda harga exchange beda misal beli bitcoin indonesia lalu jual pasar amerika fomo fear of missing out asa mau tinggal kereta harga naik mungkin naik lebih jauh
135,kalau udah turun drastis biasa a baru amatir takut kayak kasus pak jon jual bitcoin siapa menang si whaledengan gitu bisa beli bitcoinnya harga murah
136,fa fundamental analysis prediksi kualitatif event jadi dunia tim developer cryptocurrency dari kondisi psikologis orang fork buah blockchain cabang jadi entitas beda misal bitcoin bitcoin gold
137,whale alias bandar orang punya banyak cryptocurrency misal punya bitcoin margin trading trading dgn higher risk higer return basically mmpertaruhkan crypto kamu punya mndptkan ksmpatan untung lebih banyak sara ada unsur gambling
138,hodl benar typo hold alias tahan pegang erat cryptomu despite kondisi pasar lambo lamborghini se harap klo sukses d crypto bsa beli lambo moon harga naik sgt tinggi kaya pas akhr bitcoin naik usd beberapa minggu
139,investing basically naro uang tunggu bbrapa wktu dgn harap prgerakan dinamika pasar mmbuat uang kita taro tambah contoh beli bitcoin awal januari harga juta diemin taun kemudian lalu jual pas akhir desember harga an juta untung juta
140,juta hasil main bitcoin tadi yaudah pakai uang juta tadi beli xycoin puas dia pikir kalau balik modal lebih x gua pinjem orang gapapa deh akhir tabung renovasi rumah nila juta tambah pinjem uang mertua juta
141,pak jon baca altcoin beda suatu dia dapet info buah coin anggap aja nama xycoin instagram banyak sekali bilang coin bagus akan jadi bitcoin ikut bahkan ada kisah orang sosmed
142,leogemini prod me
143,jadi soal btc bearish stq timbang rasa udah telat udah naik jauh gamau fomo nih ttep weekend nnt baca dulu mau fa stq btw ni analisa
144,ginicryptocurrency mulai ad mulai ditradingkan sjak an bayangin org dri taun sgitu beli bitcoin misalny perlahan para miners sudah nambang dr dulu mrka psti puny bnyk bitcoin nah sebut whales kalo istilah crypto basically bandar lah
145,klo mrka mau nurunin hargayaudah amin jual k iman dgn harga juta semua bitcoinny harga bitcoin d pasar turun dong kalo turun tinggal borong bitcoinnya dgn harga murah manipulasi sprti cukup umum d dunia cryptocurrencyjadi emang extra hati
146,asosiasi sama sisi negatif nya internet banyak bilang bitcoin banyak pakai buat transaksi ilegal deepweb lalu banyak bilang haram tipu segala nya gimana dong ngejudge lebih baik do your own research putus sendiri
147,dua kuasa pasar dong cerita harga bitcoin waktu juta misal si amin beli bitcoin iman exchange harga juta lalu si iman beli dari amin bitcoin tadi harga juta
148,kalau pribadi nih saya megang eth xlm sama xrp entah bitcoin rasa kurang nyaman aja klo pintas lihat unggul cmn jadi cryptocurrency pertama ada lagijd sy rasa lain lbh prospek
149,analisis kena cryptocurrency maaf kalau banyak istilah susah silah tanya diskusi sengaja pakai bahasa inggris biar orang luar ngerti ngelike biar dapat uang steemit lol
150,misal bilang tiba ken beli batu harga x lipat ajax lipat bisa nah sama cryptocurrency skrg harga bitcoin misal terkolerasi sama energi modal yang pakai buat mining kalo analogi batu nyari batu sisa pulau
151,the fact sbg alat bayar crypto tu ilegal bayar sah indonesia cuma rupiah bagai alat investasi diperbolehkanwalaupun bu sri mulyani mewanti hati resiko memang tidak awas ojk berita
152,mmm tambah nih bahkan masjid nerima bitcoin buat zakat
153,lihat sesuatu bida improvisasi sistem blockchain bitcoin tapi intern biasa pandang belah mata beres intern bitcoin magazinemulailah bekerjasama sama orang bikin protocol cryptocurrency baru
154,luno cuma btc sama eth misal memang main d luno lebih prefer eth bitcoin mahal mulai banyak kompetitor lbh baik
155,batu bitcoin nya sistem catat uang blockchainnya lain bner data d mined tadi ada sama kriptografi matematika
156,yup prediksi beberapa ahli crypto taun buat yang awam kalo benar wahana nyari uang naik kelas kelas bawah tengah jadi borjuis hahaha mining so far ckup untung mas ibarat beli gpu juta bsa dpt bitcoin dolar kan
157,levelup
158,while its true di awal sebut jadi harga bitcoin naik an usd usd lalu jatoh usd perlu dilihatada return to the mean arti gera harga ke asal
159,nah makanya bilang kurang ssuai dgn visi satoshi masih volatile ini jadi dulu bitcoin cuma dapet pizza skrg bitcoin an dolar sekian juta bakal terus kayak gin lets say tahun sudah settle
160,bitcoin bangun digu an tuju wang teknologi blockchain aplikasi pelbagai bidang tnb salah satu company explore teknologi ni
161,pertama kenal istilah cryptocurrency yuk bitcoin bitcoin cryptocurrency pertama besar sekarang altcoin semua cryptocurrency bitcoin masuk bitcoin gold bitcoin cash ethereum litecoin
162,jadi cerita tahun satoshi amoto buat protocol bitcoin sekarang tau siapa satoshi ada yang spekulasi adalah elon musk soal siapa yang pintar inovatif ada yang spekulasi
163,toped emaz spreadnya gilee sama beli angka digital mending bitcoin
164,cryptocurrency thread pa bitcoin blockchain lanjut disclaimer ilmu di bidang masih rendah kalau salah silah koreksi open for discussions and questions
165,mau teknis banget bitcoin for dummies kalau buku agak jarang kalau mau follow beberapa page twitterig mau diskusi sama jg bsa cth twitter cth ig cryptolol cryptonary
166,nah bitcoin teknologi nama blockchain saat harap ubah dunia sistem bayar bagaimana hasil lanjut thread part besok maaf sudah ngantuk
167,timestamp tanggal block sebut bentuk data bitcoin misal rupa catat semua transaksi ada pernah laku contoh tanggal lalu ngirim ribu mas jon lalu tanggal lalu terima uang ribu bang jek
168,lalu orang milik cuma satu bitcointapi punya pecah up to per juta satu satoshi satoshi juta bitcoin ibarat si batu pulau tadi milik orang masing punya kan nah cerita lanjut nih
169,mulai cryptocurrency jadi aset digital dagang misal tuker bitcoin sama litecoin lalu tahun a muda lahir nama vitalik buterin orang intern bitcoin magazine kalo salah punya basis programming
170,catat harga bitcoin nya sekarang an dolar data per beberapa menit lalu saya trading lol nah pakai bitcoin ada pula jadi kapitalis tradinginvest bitcoin kan mulai masuk era aset baru
171,nah inti bitcoin tu gerak atas platform blockchain tadi data ada blockchain secure pakai cryptography misal usernamenya mkbijaksana mata umum ditranslate jadi angka huruf random kayak gin atwmnzipneverbzsnpjtzypx
172,kompetisi mndapatkn batu sisa trsebut jadi lebih berat kan tadi orang sekarang orang makanya harga si batu bakal naik asal batu hp sekarang batu beli hp analogi bitcoin mining pnjlasan mudah knapa hrga bitcoin dr dulu naik terus
173,pas financial crisis banyak kan ekonomi collapse saat nah ada jawab tuhan tahun bitcoin whitepaper keluar apa whitepaper jadi whitepaper se draft atas jelas teknis jelas kena bitcoin
174,nah masalah teknis bitcoin blockchain satoshi amoto mempropose sistem banyak adopsi skipskip jml bitcoin akn ad in existence dbuat juta analogi batu d pulau td yang udah mined ad an juta analogi batu d pulau td
175,perlahan makin bnyk org mncoba menggu an bitcoin media bayar salah satu beberapa hari lalu tahun lalu transaksi bitcoin pertama dlakukan ssorg beli pizza bitcoin harga bitcoin ekuivalen berapa puluh dolar pizza gitu dulu
176,informasi kena bitcoin nah temen pernah denger kan ttg bitcoin yuk bahas sedikit gimana bisa ubah hidup sy jadi saya jalan bisnis hias casing hp investasi dikit sahamsaya iseng nyoba main cryptocurrency
177,harga turun dong aja sekarang juta bulan depan juta arti tiap bitcoin kita punya rugi ribu kan note nyata harga bitcoin juta kita beli bitcoin bahkan jadi beli jtaeun bisa tapi gambar
178,kerja bidang it tahu apa blockchain and how powerful it is bitcoin cryptocurrency in general analogi alibaba uber gojek facebook lain a disruption udah banyak jadi kaya cryptocurrency
179,contoh bitcoin bisa analogi bagai kasus pernah di indonesia dulu kasus louhan anthurium batu akik lain mirip kan kasus harga roket its bound to crash
180,belum sama kayak si amin giur sama cepet kaya cryptocurrency beda baca dulu tidak mau asal investasi jadi bodoh nah ngabisin minggu apa tiap hari jam baca kena cryptocurrencynah awal desember investasi jumlah x d bitcoin
181,bitcoin is halal
182,ada banyak cryptocurrency cuma bitcoin saya kasih gambar harga cryptocurrency akhir tahun november bitcoin juta ethereum juta ripple ribu litecoin juta ada banyak nah cerita
183,kisah tiga inget booming aset digital alias cryptocurrency bitcoin apa nama booming banget tuh akhir berita harga naik puluh kali lipat waktu beberapa minggu adalah temenkenalan bilang kaya bitcoin
184,crash alias turun banyak kejap harga bitcoin gambaranpas november an juta awal tahun juta akhir januari kemarin sempet turun sampe an juta si nxt beli si amin sendiri turun rb bayang kan
185,kekcoin developer update kekcoin core v release kek btc crypto
186,november harga cryptocurrency tsb jauh lebih kecil yang cuman nya yang nyadan bagai arti kalau beli misal bitcoin bulan januari harga juta beli bitcoin pas november dapet juta kan untung jt
187,bitcoin lama jadi fanboism kl yang beda dapat langsung naik pitam
188,sekarang ikut pake coinhive alias numpang mining bitcoin siapa buka websitenya baca ditask manager pakai cpu sd browser opera aku note cpu aku pakai i hubung ini web banyak ngebantu jadi gpp sekali
190,tidak percaya nih kasih lihat contoh coin legit bitcoin deh lihat tuh hari hampir tahun buat nyangkut pucuk buat balik modal
191,lama hari tadi misal tidak ndablek rela aku salah lalu cut loss misal lalu akumulasi nabung pelanpelan lama harga bitcoin sekarang akan sangat cuan udah set for life mungkindibandingin dar hodl
